{
  "$schema": "./skies.parity.schema.json",
  "schemaVersion": 1,
  "policy": {
    "behaviorPatterns": {
      "dotnet": [
        "analyzers/Skies.Framework.Doctor/**/*.cs",
        "examples/sample-app/backend/**/*.cs",
        "src/**/*.cs",
        "tests/Skies.Framework.*.Tests/**/*.cs",
        "analyzers/Skies.Framework.Doctor/*.csproj",
        "examples/sample-app/backend/**/*.csproj",
        "src/**/*.csproj",
        "src/Skies.Framework.Cli/Templates/**/*.cstmpl"
      ],
      "node": [
        "node-sdk/examples/pilot-api/src/**/*.ts",
        "node-sdk/examples/sample-api/src/**/*.ts",
        "node-sdk/packages/**/*.js",
        "node-sdk/packages/**/*.mjs",
        "node-sdk/packages/**/*.ts",
        "node-sdk/examples/pilot-api/package.json",
        "node-sdk/examples/pilot-api/skies.node.json",
        "node-sdk/examples/pilot-api/stryker.config.mjs",
        "node-sdk/examples/sample-api/package.json",
        "node-sdk/packages/*/package.json"
      ]
    },
    "ignoredBehavior": [
      "tests/Skies.Framework.SelfHarness.Tests/**/*.cs"
    ]
  },
  "sharedContracts": [
    {
      "id": "jwt.hs256",
      "path": "tests/fixtures/jwt-interop.json",
      "consumers": {
        "dotnet": [
          "tests/Skies.Framework.Auth.Tests/AccessTokenValidationTests.cs",
          "tests/Skies.Framework.Auth.Tests/Skies.Framework.Auth.Tests.csproj"
        ],
        "node": [
          "node-sdk/packages/auth/src/index.test.ts"
        ]
      }
    }
  ],
  "capabilities": [
    {
      "id": "architecture.explicit-slices",
      "statement": "Runtime composition remains explicit and portable: markers/contracts carry metadata but never hidden behavior.",
      "parity": "adapter-specific",
      "dotnet": {
        "scopes": [
          "src/Skies.Framework.Abstractions/EntityAttribute.cs",
          "src/Skies.Framework.Abstractions/ModuleAttribute.cs",
          "src/Skies.Framework.Abstractions/SliceAttribute.cs"
        ],
        "proofs": [
          {
            "kind": "doctor",
            "path": "tests/Skies.Framework.Doctor.Tests/SliceConformanceAnalyzerTests.cs"
          },
          {
            "kind": "doctor",
            "path": "tests/Skies.Framework.Doctor.Tests/ModuleAnalyzerTests.cs"
          }
        ]
      },
      "node": {
        "scopes": [
          "node-sdk/packages/openapi/src/types.ts",
          "node-sdk/packages/express/src/map-slice.ts"
        ],
        "proofs": [
          {
            "kind": "test",
            "path": "node-sdk/packages/openapi/src/index.test.ts"
          },
          {
            "kind": "test",
            "path": "node-sdk/packages/express/src/map-slice.test.ts"
          }
        ]
      },
      "sharedContracts": []
    },
    {
      "id": "core.ordered-lifecycle",
      "statement": "Lifecycle participants advance in declared order without skips or regressions.",
      "parity": "equivalent",
      "dotnet": {
        "scopes": [
          "src/Skies.Framework.Abstractions/OrderedLifecycle.cs"
        ],
        "proofs": [
          {
            "kind": "test",
            "path": "tests/Skies.Framework.Abstractions.Tests/OrderedLifecycleTests.cs"
          }
        ]
      },
      "node": {
        "scopes": [
          "node-sdk/packages/core/src/ordered-lifecycle.ts"
        ],
        "proofs": [
          {
            "kind": "test",
            "path": "node-sdk/packages/core/src/ordered-lifecycle.test.ts"
          }
        ]
      },
      "sharedContracts": []
    },
    {
      "id": "core.page",
      "statement": "Paged results preserve bounds, totals, emptiness, and projection metadata.",
      "parity": "equivalent",
      "dotnet": {
        "scopes": [
          "src/Skies.Framework.Abstractions/Page.cs"
        ],
        "proofs": [
          {
            "kind": "test",
            "path": "tests/Skies.Framework.Abstractions.Tests/PageTests.cs"
          }
        ]
      },
      "node": {
        "scopes": [
          "node-sdk/packages/core/src/page.ts"
        ],
        "proofs": [
          {
            "kind": "test",
            "path": "node-sdk/packages/core/src/page.test.ts"
          }
        ]
      },
      "sharedContracts": []
    },
    {
      "id": "core.result-errors",
      "statement": "Handlers use a closed result and nine-kind error algebra with stable field errors.",
      "parity": "equivalent",
      "dotnet": {
        "scopes": [
          "src/Skies.Framework.Abstractions/Result.cs"
        ],
        "proofs": [
          {
            "kind": "test",
            "path": "tests/Skies.Framework.Abstractions.Tests/ResultTests.cs"
          }
        ]
      },
      "node": {
        "scopes": [
          "node-sdk/packages/core/src/index.ts",
          "node-sdk/packages/core/src/result.ts"
        ],
        "proofs": [
          {
            "kind": "test",
            "path": "node-sdk/packages/core/src/index.test.ts"
          }
        ]
      },
      "sharedContracts": []
    },
    {
      "id": "core.scalar-wire",
      "statement": "Nominal domain scalars cross transport boundaries through explicit primitive codecs.",
      "parity": "wire-compatible",
      "dotnet": {
        "scopes": [
          "src/Skies.Framework.Abstractions/ScalarJsonConverter.cs",
          "src/Skies.Framework.Abstractions/ValueObjectAttribute.cs"
        ],
        "proofs": [
          {
            "kind": "test",
            "path": "tests/Skies.Framework.Abstractions.Tests/ScalarJsonConverterTests.cs"
          }
        ]
      },
      "node": {
        "scopes": [
          "node-sdk/packages/core/src/scalar-codec.ts",
          "node-sdk/packages/openapi/src/scalar.ts"
        ],
        "proofs": [
          {
            "kind": "test",
            "path": "node-sdk/packages/core/src/scalar-codec.test.ts"
          },
          {
            "kind": "test",
            "path": "node-sdk/packages/openapi/src/scalar.test.ts"
          }
        ]
      },
      "sharedContracts": []
    },
    {
      "id": "core.validation",
      "statement": "Validation accumulates stable field failures and preserves nested field paths.",
      "parity": "equivalent",
      "dotnet": {
        "scopes": [
          "src/Skies.Framework.Abstractions/Validation.cs"
        ],
        "proofs": [
          {
            "kind": "test",
            "path": "tests/Skies.Framework.Abstractions.Tests/ValidationTests.cs"
          }
        ]
      },
      "node": {
        "scopes": [
          "node-sdk/packages/core/src/validation.ts"
        ],
        "proofs": [
          {
            "kind": "test",
            "path": "node-sdk/packages/core/src/validation.test.ts"
          }
        ]
      },
      "sharedContracts": []
    },
    {
      "id": "data.postgres",
      "statement": "Reference persistence proves stable tenant paging, bounded materialization, raw SQL ownership, and optimistic concurrency.",
      "parity": "adapter-specific",
      "dotnet": {
        "scopes": [
          "src/Skies.Framework.EntityFrameworkCore/**/*.cs"
        ],
        "proofs": [
          {
            "kind": "integration",
            "path": "tests/Skies.Framework.EntityFrameworkCore.Tests/**/*.cs"
          }
        ]
      },
      "node": {
        "scopes": [
          "node-sdk/packages/drizzle-postgres/src/**/*.ts"
        ],
        "proofs": [
          {
            "kind": "test",
            "path": "node-sdk/packages/drizzle-postgres/src/index.test.ts"
          },
          {
            "kind": "integration",
            "path": "node-sdk/packages/drizzle-postgres/src/integration.test.ts"
          }
        ]
      },
      "sharedContracts": []
    },
    {
      "id": "delivery.packages-release",
      "statement": "Both runtimes ship immutable versioned packages with dependency ordering and post-install consumption proof.",
      "parity": "equivalent",
      "dotnet": {
        "scopes": [
          "build/Skies.Framework.Library.props",
          "frontend-sdk/tools/release-guard.mjs",
          ".github/workflows/publish.yml"
        ],
        "proofs": [
          {
            "kind": "test",
            "path": "frontend-sdk/tools/release-guard.test.ts"
          },
          {
            "kind": "build",
            "path": "Skies.Framework.slnx"
          }
        ]
      },
      "node": {
        "scopes": [
          "node-sdk/packages/framework/package.json",
          "node-sdk/tools/package-smoke.mjs",
          ".github/workflows/publish.yml"
        ],
        "proofs": [
          {
            "kind": "package-smoke",
            "path": "node-sdk/tools/package-smoke.mjs"
          },
          {
            "kind": "test",
            "path": "frontend-sdk/tools/release-guard.test.ts"
          }
        ]
      },
      "sharedContracts": []
    },
    {
      "id": "doctor.enforcement",
      "statement": "Removable static doctors enforce application shape, auth, error ownership, journeys, and proof completeness.",
      "parity": "adapter-specific",
      "dotnet": {
        "scopes": [
          "analyzers/Skies.Framework.Doctor/**/*.cs"
        ],
        "proofs": [
          {
            "kind": "doctor",
            "path": "tests/Skies.Framework.Doctor.Tests/**/*.cs"
          }
        ]
      },
      "node": {
        "scopes": [
          "node-sdk/packages/doctor/**/*.ts",
          "node-sdk/packages/doctor/**/*.mjs",
          "node-sdk/packages/eslint-plugin-skies-node/**/*.js",
          "node-sdk/packages/eslint-plugin-skies-node/index.d.ts",
          "node-sdk/packages/eslint-plugin-skies-node/fixtures/**/*.ts"
        ],
        "proofs": [
          {
            "kind": "doctor",
            "path": "node-sdk/packages/doctor/src/**/*.test.ts"
          },
          {
            "kind": "test",
            "path": "node-sdk/packages/eslint-plugin-skies-node/**/*.test.js"
          }
        ]
      },